"company","job description","required qualification","location"
"Power Grid Corporation of India Limited","Safety Trainee (Substation). 12-month on-site role. Assist the safety officer with inspections,  training,  and documentation at a high-voltage substation.","Diploma in Industrial Safety or B.Sc (any discipline). Must meet PMIS age and income criteria.","Lucknow,  Uttar Pradesh"
"ITC Limited","HR Trainee (Admin). 12-month office role at a factory. Support HR functions like time-keeping,  employee records,  and training coordination.","BBA (HR) graduate (non-premier institute). Must meet PMIS age (21-24) and income (<8L) criteria.","Sahara,  Uttar Pradesh"
"Tata Consultancy Services Limited","Finance Trainee (BPO). 12-month role processing financial transactions (e.g.,  accounts payable) for a corporate client. Requires attention to detail.","B.Com graduate (non-premier institute). Must meet PMIS age (21-24) and income (<8L) criteria.","Mumbai,  Maharashtra"
"HCL Technologies Limited","IT Helpdesk Trainee (Internal). 12-month role providing basic IT support to HCL employees. Handle password resets,  software installation.","B.Sc (IT) or BCA (non-premier institute). Must meet PMIS age (21-24) and income (<8L) criteria.","Bengaluru,  Karnataka"
"Muthoot Finance Limited","Gold Appraiser Trainee. 12-month branch role. Learn to test gold purity,  weigh ornaments,  and manage documentation for gold loans under supervision.","B.Com or B.A. graduate (non-premier institute). Must meet PMIS age (21-24) and income (<8L) criteria.","Chennai,  Tamil Nadu"
"Oil India Limited","Finance Trainee (Admin). 12-month office role at a field HQ. Assist the finance team with data entry,  bill processing,  and voucher management.","B.Com graduate (non-premier institute). Must meet PMIS age (21-24) and income (<8L) criteria.","Duliajan,  Assam"
"Steel Authority of India Limited","Operations Trainee (Blast Furnace). 12-month hands-on role. Learn blast furnace operations,  monitor parameters,  and assist in process control.","Diploma in Metallurgical Engineering. Must meet PMIS age (21-24) and income (<8L) criteria.","Burnpur,  West Bengal"
"Kotak Mahindra Bank Limited","Operations Trainee (Back-Office). 12-month role. Process customer requests (e.g.,  address change,  stop payment),  data entry,  and file management.","B.Com or B.A. graduate (non-premier institute). Must meet PMIS age (21-24) and income (<8L) criteria.","New Delhi,  Delhi"
"Tech Mahindra Limited","HR Trainee (Onboarding). 12-month role assisting the HR team. Manage new hire documentation,  coordinate background verification,  and support induction.","BBA (HR) graduate (non-premier institute). Must meet PMIS age (21-24) and income (<8L) criteria.","Hyderabad,  Telangana"
"Northern Coalfields Limited","Electrical Maintenance Trainee (Workshop). 12-month role. Assist in repairing and overhauling electrical components of heavy mining equipment.","Diploma in Electrical Engineering (EEE). Must meet PMIS age (21-24) and income (<8L) criteria.","Singrauli,  Madhya Pradesh"
"UltraTech Cement Limited","Logistics Trainee (Warehouse). 12-month role managing inventory of spare parts and materials at the plant stores.","B.Com (Logistics) or Diploma in Materials Management. Must meet PMIS age and income criteria.","Chandrapur,  Maharashtra"
"Hero MotoCorp Limited","Assembly Trainee (Engine). 12-month shop-floor role. Learn to assemble two-wheeler engines,  use tools,  and perform quality checks.","ITI (Fitter/Mechanic) or Diploma in Mechanical/Automobile Engineering. Must meet PMIS eligibility.","Gurugram,  Haryana"
"NHPC Limited","HR Trainee (Admin). 12-month office role at a power station. Support HR functions like time-keeping,  employee records,  and training coordination.","BBA (HR) graduate (non-premier institute). Must meet PMIS age (21-24) and income (<8L) criteria.","Tanakpur,  Uttarakhand"
"Asian Paints Limited","Operations Trainee (Production). 12-month hands-on role at the paint manufacturing plant. Learn batch processing,  machine operation,  and quality control.","Diploma in Chemical/Mechanical Engineering. Must meet PMIS age (21-24) and income (<8L) criteria.","Patancheru,  Telangana"
"IndusInd Bank Ltd","Branch Operations Trainee. 12-month customer-facing role. Handle queries,  assist with deposits/withdrawals,  and explain banking products.","Class 12 Pass or B.A. (any discipline). Good communication skills. Must meet PMIS eligibility.","Chandigarh,  Punjab"
"Samsung India Electronics Private Limited","Maintenance Trainee (Mechanical). 12-month hands-on role. Assist technicians in maintaining mechanical systems of the automated assembly line.","Diploma in Mechanical/Mechatronics Engineering. Must meet PMIS age and income criteria.","Noida,  Uttar Pradesh"
"Mahanadi Coalfields Limited","Civil Trainee (Site). 12-month on-site role. Assist in supervising civil construction and maintenance projects in the colliery area.","Diploma in Civil Engineering. Must meet PMIS age (21-24) and income (<8L) criteria.","Talcher,  Odisha"
"Shriram Finance Limited","Sales Support Trainee. 12-month branch role. Assist the sales team with documentation,  customer follow-ups,  and data entry.","B.Com or BBA (Marketing) (non-premier institute). Must meet PMIS age and income criteria.","Nagpur,  Maharashtra"
"Bandhan Bank Limited","Data Entry Trainee (Loan). 12-month back-office role. Enter data from loan applications into the system. High accuracy required.","Class 12 Pass or B.A. (any discipline). Good typing skills. Must meet PMIS eligibility.","Kolkata,  West Bengal"
"Ambuja Cements Limited","Stores Trainee. 12-month role in the plant stores. Manage inventory of spare parts,  issue materials,  and maintain records.","B.Com or Diploma in Materials Management. Must meet PMIS age (21-24) and income (<8L) criteria.","Ropar,  Punjab"
"Oil and Natural Gas Corporation Limited","HR Trainee (Admin). 12-month office role. Assist with employee records,  leave management,  and processing claims.","BBA or B.A. (any discipline) graduate (non-premier). Must meet PMIS age and income criteria.","Mumbai,  Maharashtra"
"Maruti Suzuki India Limited","Store Keeper Trainee (Engineering). 12-month role managing inventory of engineering spares and tools. Issue items and maintain records.","Diploma in Mechanical Engineering. Must meet PMIS age (21-24) and income (<8L) criteria.","Gurugram,  Haryana"
"HDFC Bank Limited","Loan Operations Trainee. 12-month back-office role. Verify documents for auto loans,  check compliance,  and coordinate with dealers.","B.Com or BBA graduate (non-premier institute). Must meet PMIS age (21-24) and income (<8L) criteria.","Pune,  Maharashtra"
"Reliance Industries Limited","Maintenance Trainee (Electrical). 12-month hands-on role at the refinery. Assist in maintenance of motors,  transformers,  and switchgear.","ITI (Electrician) or Diploma in Electrical Engineering. Must meet PMIS age (21-24) and income (<8L) criteria.","Jamnagar,  Gujarat"
"Infosys Limited","HR Trainee (Operations). 12-month role supporting the HR team. Assist with data management,  onboarding,  and exit formalities.","BBA (HR) graduate (non-premier institute). Must meet PMIS age (21-24) and income (<8L) criteria.","Bengaluru,  Karnataka"
"Tata Steel Limited","Operations Trainee (Rolling Mill). 12-month hands-on role. Learn operation of hot/cold rolling mills,  monitor product quality,  and support shift team.","Diploma in Mechanical/Metallurgical Engineering. Must meet PMIS age (21-24) and income (<8L) criteria.","Jamshedpur,  Jharkhand"
"Larsen and Toubro Limited","Finance Trainee (Project Site). 12-month on-site role. Assist with vendor bill processing,  time-keeping,  and expense reporting.","B.Com graduate (non-premier institute). Must meet PMIS age (21-24) and income (<8L) criteria.","Mumbai,  Maharashtra"
"ICICI Bank Limited","Customer Service Trainee (Branch). 12-month customer-facing role. Handle queries,  assist with deposits/withdrawals,  and explain banking products.","Class 12 Pass or B.A. (any discipline). Good communication skills. Must meet PMIS eligibility.","Ahmedabad,  Gujarat"
"Hindustan Unilever Limited","Lab Trainee (Quality Control). 12-month role in a factory lab. Test raw materials and finished goods (soaps,  detergents) for quality parameters.","B.Sc (Chemistry) (non-premier institute). Must meet PMIS age (21-24) and income (<8L) criteria.","Mumbai,  Maharashtra"
"Wipro Limited","Technical Support Trainee (Voice). 12-month role supporting customers with PC/laptop issues. Learn troubleshooting for hardware,  software,  and networking.","B.Sc (IT) or BCA (non-premier institute). Good communication skills required. Must meet PMIS eligibility.","Gurugram,  Haryana"
"Mahindra and Mahindra Limited","HR Trainee (Time Office). 12-month office role at the plant. Manage employee attendance records,  shift rosters,  and leave data.","BBA (HR) graduate (non-premier institute). Must meet PMIS age (21-24) and income (<8L) criteria.","Kandivali,  Maharashtra"
"GAIL (India) Limited","HR Trainee (Admin). 12-month office role at a plant. Support recruitment coordination,  employee onboarding,  and managing personnel files.","BBA (HR) graduate (non-premier institute). Must meet PMIS age and income criteria.","Auraiya,  Uttar Pradesh"
"Bajaj Auto Limited","Quality Inspection Trainee (Engine). 12-month role. Inspect engine components and assemblies using gauges and measuring instruments.","Diploma in Mechanical/Automobile Engineering. Must meet PMIS age (21-24) and income (<8L) criteria.","Waluj,  Maharashtra"
"NTPC Limited","Safety Trainee. 12-month on-site role at the power plant. Assist the safety department with inspections,  training,  and documentation.","Diploma in Industrial Safety or B.Sc (any discipline). Must meet PMIS age and income criteria.","Vindhyachal,  Madhya Pradesh"
"Axis Bank Limited","Customer Service Trainee (Branch). 12-month customer-facing role. Handle queries,  assist with deposits/withdrawals,  and explain banking products.","Class 12 Pass or B.A. (any discipline). Good communication skills. Must meet PMIS eligibility.","Hyderabad,  Telangana"
"Indian Oil Corporation Limited","Operations Trainee (Lube Blending). 12-month hands-on role at a lube blending plant. Learn blending operations,  quality control,  and packaging.","Diploma in Chemical/Mechanical Engineering or B.Sc (Chemistry). Must meet PMIS age and income criteria.","Chennai,  Tamil Nadu"
"Hindustan Petroleum Corporation Limited","Maintenance Trainee (Mechanical). 12-month hands-on role at a refinery. Assist in maintenance of pumps,  compressors,  and rotating equipment.","ITI (Fitter) or Diploma in Mechanical Engineering. Must meet PMIS age and income criteria.","Mumbai,  Maharashtra"
"Reliance Retail Limited","Inventory Trainee (Reliance Digital). 12-month store-based role. Manage stock of electronics,  coordinate with warehouse,  and handle inventory records.","B.Com (Logistics) or BBA (non-premier institute). Must meet PMIS age (21-24) and income (<8L) criteria.","New Delhi,  Delhi"
"JSW Steel Limited","Maintenance Trainee (Mechanical). 12-month hands-on role. Assist in the maintenance and repair of plant machinery (e.g.,  mills,  cranes).","ITI (Fitter) or Diploma in Mechanical Engineering. Must meet PMIS age (21-24) and income (<8L) criteria.","Vijayanagar,  Karnataka"
"Power Grid Corporation of India Limited","Electrical Trainee (Substation). 12-month on-site role. Learn operation and maintenance of high-voltage switchgear and transformers.","Diploma in Electrical Engineering (EEE). Must meet PMIS age (21-24) and income (<8L) criteria. Not from IIT.","Jalandhar,  Punjab"
"ITC Limited","Manufacturing Trainee (Packaging). 12-month role at a packaging plant. Learn printing and packaging machine operations,  quality checks.","Diploma in Printing/Mechanical Engineering. Must meet PMIS age (21-24) and income (<8L) criteria.","Chennai,  Tamil Nadu"
"Tata Consultancy Services Limited","HR Trainee (Onboarding). 12-month role assisting the HR team. Manage new hire documentation,  coordinate background verification,  and support induction.","BBA (HR) graduate (non-premier institute). Must meet PMIS age (21-24) and income (<8L) criteria.","Bengaluru,  Karnataka"
"HCL Technologies Limited","Finance Trainee (BPO). 12-month role processing financial transactions (e.g.,  accounts payable) for a corporate client. Requires attention to detail.","B.Com graduate (non-premier institute). Must meet PMIS age (21-24) and income (<8L) criteria.","Chennai,  Tamil Nadu"
"Muthoot Finance Limited","Customer Care Trainee. 12-month branch-based role. Handle customer queries,  explain financial products,  and provide administrative support.","Class 12 Pass or B.A. (any discipline). Good communication skills required. Must meet PMIS eligibility.","Thiruvananthapuram,  Kerala"
"Oil India Limited","Electrical Maintenance Trainee. 12-month hands-on role. Assist electricians in maintaining electrical systems at field installations.","Diploma in Electrical Engineering (EEE). Must meet PMIS age (21-24) and income (<8L) criteria.","Duliajan,  Assam"
"Steel Authority of India Limited","Mechanical Maintenance Trainee (Rolling Mill). 12-month hands-on role. Assist in maintenance of rolling mill equipment.","ITI (Fitter) or Diploma in Mechanical Engineering. Must meet PMIS age and income criteria.","Bokaro,  Jharkhand"
"Kotak Mahindra Bank Limited","HR Trainee (Admin). 12-month role supporting the HR team. Assist with employee records,  leave management,  and data entry.","BBA (HR) graduate (non-premier institute). Must meet PMIS age (21-24) and income (<8L) criteria.","Mumbai,  Maharashtra"
"Tech Mahindra Limited","IT Helpdesk Trainee (Voice). 12-month role providing technical support to customers via phone. Troubleshoot hardware/software issues.","B.Sc (IT) or BCA (non-premier institute). Good communication skills. Must meet PMIS eligibility.","Noida,  Uttar Pradesh"
"Northern Coalfields Limited","Civil Maintenance Trainee. 12-month on-site role. Assist in maintaining buildings,  roads,  and infrastructure in the colliery area.","Diploma in Civil Engineering. Must meet PMIS age (21-24) and income (<8L) criteria.","Singrauli,  Madhya Pradesh"
"UltraTech Cement Limited","Quality Control Trainee (Lab). 12-month lab role. Test cement and raw materials. Learn chemical and physical testing procedures.","B.Sc (Chemistry). Must meet PMIS age (21-24) and income (<8L) criteria. Not from premier institute.","Jharsuguda,  Odisha"
"Hero MotoCorp Limited","Maintenance Trainee (Electrical). 12-month hands-on role. Assist in maintaining electrical systems on the assembly line (PLCs,  motors,  sensors).","Diploma in Electrical/Electronics Engineering (EEE/ECE). Must meet PMIS age and income criteria.","Jaipur,  Rajasthan"
"NHPC Limited","Civil Trainee (Site). 12-month on-site role at a project/power station. Assist in supervising civil maintenance and inspection of structures.","Diploma in Civil Engineering. Must meet PMIS age (21-24) and income (<8L) criteria.","Chutak,  Ladakh"
"Asian Paints Limited","Production Trainee (Operations). 12-month hands-on role at the paint manufacturing plant. Learn batch processing,  machine operation,  and quality control.","Diploma in Chemical/Mechanical Engineering. Must meet PMIS age (21-24) and income (<8L) criteria.","Visakhapatnam,  Andhra Pradesh"
"IndusInd Bank Ltd","KYC Verification Trainee. 12-month back-office role. Verify customer identity documents,  check for compliance,  and update records.","B.Com or B.A. graduate (non-premier institute). Must meet PMIS age (21-24) and income (<8L) criteria.","Chennai,  Tamil Nadu"
"Samsung India Electronics Private Limited","Logistics Trainee (Operations). 12-month role managing inbound/outbound material flow for the factory. Use SAP for inventory tracking.","B.Com (Logistics) or BBA (non-premier institute). Must meet PMIS age (21-24) and income (<8L) criteria.","Noida,  Uttar Pradesh"
"Mahanadi Coalfields Limited","Finance Trainee (Admin). 12-month office role. Assist the finance team with data entry,  bill processing,  and voucher management.","B.Com graduate (non-premier institute). Must meet PMIS age (21-24) and income (<8L) criteria.","Sambalpur,  Odisha"
"Shriram Finance Limited","Branch Operations Trainee. 12-month role. Support branch staff with customer service,  cash handling (under supervision),  and documentation.","B.Com or B.A. graduate (non-premier institute). Must meet PMIS age (21-24) and income (<8L) criteria.","Kolkata,  West Bengal"
"Bandhan Bank Limited","Loan Officer Trainee (Field). 12-month role involving fieldwork. Learn customer acquisition in rural/semi-urban areas,  group loan processing,  and collections.","Class 12 Pass or B.A. (any discipline). Must be willing to travel. Must meet PMIS age and income criteria.","Bhubaneswar,  Odisha"
"Ambuja Cements Limited","Operations Trainee (Kiln). 12-month hands-on role. Learn kiln operations,  monitor control panels,  and assist shift engineers.","Diploma in Chemical Engineering. Must meet PMIS age (21-24) and income (<8L) criteria.","Chandrapur,  Maharashtra"
"Oil and Natural Gas Corporation Limited","Mechanical Maintenance Trainee. 12-month hands-on role. Assist in maintenance of pumps,  compressors,  and engines at a production installation.","ITI (Fitter) or Diploma in Mechanical Engineering. Must meet PMIS age (21-24) and income (<8L) criteria.","Ahmedabad,  Gujarat"
"Maruti Suzuki India Limited","Paint Shop Operations Trainee. 12-month hands-on role. Learn surface preparation,  painting processes,  and quality inspection of painted vehicles.","ITI (Painter) or Diploma in Chemical/Paint Technology. Must meet PMIS age and income criteria.","Gurugram,  Haryana"
"HDFC Bank Limited","Credit Operations Trainee. 12-month back-office role. Support credit card application processing,  data verification,  and documentation.","B.Com or BBA graduate (non-premier institute). Must meet PMIS age (21-24) and income (<8L) criteria.","Mumbai,  Maharashtra"
"Reliance Industries Limited","Maintenance Trainee (Instrumentation). 12-month hands-on role at the refinery. Assist technicians in calibrating and maintaining field instruments.","Diploma in Instrumentation Engineering (EIE). Must meet PMIS age (21-24) and income (<8L) criteria.","Jamnagar,  Gujarat"
"Infosys Limited","BPO Trainee (Technical Support). 12-month role handling technical queries (voice/chat) for a client. Learn troubleshooting and customer service.","B.Sc (IT) or BCA (non-premier institute). Good communication skills. Must meet PMIS eligibility.","Pune,  Maharashtra"
"Tata Steel Limited","Electrical Maintenance Trainee (Power Plant). 12-month role at the captive power plant. Assist in maintenance of generators,  switchgear,  and transformers.","Diploma in Electrical Engineering (EEE). Must meet PMIS age (21-24) and income (<8L) criteria.","Jamshedpur,  Jharkhand"
"Larsen and Toubro Limited","Supply Chain Trainee (Site). 12-month on-site role. Manage materials,  coordinate with suppliers,  and maintain inventory records at a construction project.","B.Com (Logistics) or Diploma in Materials Management. Must meet PMIS age and income criteria.","Nagpur,  Maharashtra"
"ICICI Bank Limited","HR Trainee (Admin). 12-month role supporting the HR team. Assist with employee records,  leave management,  and data entry.","BBA (HR) graduate (non-premier institute). Must meet PMIS age (21-24) and income (<8L) criteria.","Hyderabad,  Telangana"
"Hindustan Unilever Limited","Production Trainee. 12-month hands-on role at a factory. Learn machine operations,  quality checks"," and safety protocols on the production line.","ITI (Fitter) or Diploma in Mechanical Engineering. Must meet PMIS age (21-24) and income (<8L) criteria., Goa"
"Wipro Limited","HR Trainee (Recruitment Support). 12-month role assisting the HR team. Source resumes,  schedule interviews,  and coordinate with candidates.","BBA (HR) graduate (non-premier institute). Must meet PMIS age (21-24) and income (<8L) criteria.","Bengaluru,  Karnataka"
"Mahindra and Mahindra Limited","Manufacturing Trainee (Paint Shop). 12-month shop-floor role. Learn surface preparation,  painting,  and inspection processes for vehicles.","ITI (Painter) or Diploma in Chemical/Paint Technology. Must meet PMIS age and income criteria.","Nashik,  Maharashtra"
"GAIL (India) Limited","Finance Trainee (Admin). 12-month office role. Assist the finance team with bill processing,  data entry,  and voucher management.","B.Com graduate (non-premier institute). Must meet PMIS age (21-24) and income (<8L) criteria.","New Delhi,  Delhi"
"Bajaj Auto Limited","Assembly Trainee (Engine). 12-month shop-floor role. Learn to assemble two-wheeler engines,  use tools,  and perform quality checks.","ITI (Fitter/Mechanic) or Diploma in Mechanical/Automobile Engineering. Must meet PMIS eligibility.","Chakan,  Maharashtra"
"NTPC Limited","Electrical Maintenance Trainee. 12-month hands-on role at the power plant. Assist in maintenance of motors,  panels,  and switchgear.","Diploma in Electrical Engineering (EEE). Must meet PMIS age (21-24) and income (<8L) criteria. Not from IIT.","Ramagundam,  Telangana"
"Axis Bank Limited","Operations Trainee (Data Entry). 12-month back-office role. Perform high-volume data entry for customer records and applications. High accuracy required.","Class 12 Pass or B.A. (any discipline). Good typing speed. Must meet PMIS eligibility.","Bengaluru,  Karnataka"
"Indian Oil Corporation Limited","Operations Trainee (Refinery). 12-month rotational shift role. Learn refinery unit operations,  monitor parameters,  and assist shift engineers.","Diploma in Chemical Engineering. Must meet PMIS age (21-24) and income (<8L) criteria. Not from IIT.","Guwahati,  Assam"
"Hindustan Petroleum Corporation Limited","Refinery Operations Trainee. 12-month rotational shift role. Learn refinery unit operations,  monitor parameters,  and assist shift engineers.","Diploma in Chemical Engineering. Must meet PMIS age (21-24) and income (<8L) criteria. Not from IIT.","Mumbai,  Maharashtra"
"Reliance Retail Limited","Customer Service Trainee (JioMart). 12-month role handling customer queries (phone/email) for e-commerce operations. Resolve delivery and order issues.","B.A. or B.Com graduate (non-premier). Good communication skills. Must meet PMIS eligibility.","Thane,  Maharashtra"
"JSW Steel Limited","Operations Trainee (Steel Melting Shop). 12-month hands-on role. Learn steelmaking processes,  assist in operations,  and support quality sampling.","Diploma in Metallurgical Engineering. Must meet PMIS age (21-24) and income (<8L) criteria.","Salem,  Tamil Nadu"
"Power Grid Corporation of India Limited","Finance Trainee (Admin). 12-month office role. Assist the finance team with bill processing,  data entry,  and voucher management.","B.Com graduate (non-premier institute). Must meet PMIS age (21-24) and income (<8L) criteria.","Patna,  Bihar"
"ITC Limited","Operations Trainee (Food Production). 12-month hands-on role at a food plant (e.g.,  Sunfeast). Learn machine operations,  quality checks,  and packaging.","Diploma in Food Processing/Mechanical Engineering. Must meet PMIS age and income criteria.","Haridwar,  Uttarakhand"
"Tata Consultancy Services Limited","Helpdesk Trainee (Internal HR). 12-month role supporting TCS employees with HR-related queries (e.g.,  leave,  payroll,  policy).","BBA (HR) or B.A. (any discipline) graduate (non-premier). Must meet PMIS age and income criteria.","Chennai,  Tamil Nadu"
"HCL Technologies Limited","IT Helpdesk Trainee (Internal). 12-month role providing basic IT support to HCL employees. Handle password resets,  software installation.","B.Sc (IT) or BCA (non-premier institute). Must meet PMIS age (21-24) and income (<8L) criteria.","Nagpur,  Maharashtra"
"Muthoot Finance Limited","Branch Operations Trainee. 12-month role. Learn customer service,  gold appraisal,  and documentation for financial products.","B.Com or B.A. graduate (non-premier institute). Must meet PMIS age (21-24) and income (<8L) criteria.","Coimbatore,  Tamil Nadu"
"Oil India Limited","Mechanical Maintenance Trainee. 12-month hands-on role. Assist in maintenance of pumps,  compressors,  and engines at a field installation.","ITI (Fitter/Mechanic) or Diploma in Mechanical Engineering. Must meet PMIS age and income criteria.","Jaisalmer,  Rajasthan"
"Steel Authority of India Limited","Operations Trainee (Rolling Mill). 12-month hands-on role. Learn operation of rolling mills,  monitor product quality,  and support shift team.","Diploma in Mechanical/Metallurgical Engineering. Must meet PMIS age and income criteria.","Durgapur,  West Bengal"
"Kotak Mahindra Bank Limited","Loan Operations Trainee. 12-month back-office role. Verify documents for personal/auto loans,  check compliance,  and coordinate with sales.","B.Com or BBA graduate (non-premier institute). Must meet PMIS age (21-24) and income (<8L) criteria.","Mumbai,  Maharashtra"
"Tech Mahindra Limited","Customer Support Trainee (Voice). 12-month role handling customer queries (voice) for a telecom client. Troubleshoot service issues.","B.A. or B.Sc (any discipline,  non-premier). Good communication skills. Must meet PMIS eligibility.","Pune,  Maharashtra"
"Northern Coalfields Limited","Mechanical Maintenance Trainee (HEMM). Assist in the maintenance and repair of Heavy Earth Moving Machinery (dumpers,  shovels). 12-month workshop/field role.","Diploma in Mechanical/Automobile Engineering or ITI (Mechanic). Must meet PMIS age and income criteria.","Singrauli,  Madhya Pradesh"
"UltraTech Cement Limited","Operations Trainee (Production). 12-month hands-on role assisting in kiln and mill operations. Monitor control panels and support shift engineers.","Diploma in Chemical Engineering. Must meet PMIS age (21-24) and income (<8L) criteria.","Awarpur,  Maharashtra"
